t,y_t,text,split
2018-08-15,326.3999938964844,"KEY EVENTS AND FACTS:
Notable investors filed their Q2 13F reports, revealing a clear shift in portfolio composition. Warren Buffett’s Berkshire Hathaway increased its stake in Apple and added a new position in Occidental Petroleum while trimming several regional bank holdings. David Einhorn’s Greenlight Capital cut back on high‑growth technology names, exiting Tesla and reducing its Amazon exposure, and redirected capital into energy and industrial stocks. James Loeb’s fund boosted consumer‑staples holdings such as Procter & Gamble and entered a sizable health‑care REIT position, underscoring a move toward more defensive sectors as the S&P 500 hovered near record highs.  

FORWARD-LOOKING SIGNALS:
The increased weighting in energy and industrials signals investor confidence that commodity prices will rise and that infrastructure spending may accelerate under current policy. Reduced exposure to technology suggests concerns over lofty valuations and anticipated earnings volatility in the sector. Growing allocations to consumer staples and health‑care REITs point to expectations of slower overall growth and a hedge against potential interest‑rate hikes. Analysts interpret these trends as the beginning of a rotation from growth to value stocks, forecasting more modest earnings growth and heightened market sensitivity to macro‑economic shifts for the remainder of 2018.",context
2018-08-16,322.44000244140625,"**KEY EVENTS AND FACTS:**  
Netflix reported a sharp increase in subscriber churn as competition from Disney+, HBO Max, and other streaming services intensified, prompting the company to accelerate its content production schedule. The firm announced a $15 billion capital outlay for original programming in the next fiscal year, aiming to secure exclusive titles and retain market share. Earnings for the quarter showed revenue growth of 9 % year‑over‑year, but operating margins slipped due to higher content costs and rising marketing spend. Analysts noted that Netflix’s cash flow remains robust, with a cash balance of $7.5 billion at quarter‑end, providing flexibility for the upcoming content push.

**FORWARD-LOOKING SIGNALS:**  
Management signaled that the next 12‑month content slate will focus heavily on international productions, targeting growth in emerging markets where subscriber penetration is still low. Analysts forecast that Netflix’s subscriber base could plateau in the U.S. by late 2019, shifting the company’s growth reliance to overseas expansion and ad‑supported tiers. The company hinted at testing a lower‑price, ad‑supported subscription model in select regions, which could open a new revenue stream and attract price‑sensitive consumers. Market watchers expect the aggressive spending to pressure profitability in the short term but anticipate a rebound in margins once the new content library drives subscriber acquisition and retention.",context
2018-08-17,316.7799987792969,,context
2018-08-20,327.7300109863281,"KEY EVENTS AND FACTS:
Netflix announced that it is testing the insertion of advertisements for other Netflix shows between episodes of its original series, marking its first foray into an ad‑supported model on its platform. The pilot, rolled out to a limited number of U.S. subscribers, will display short promotional spots for Netflix‑owned content rather than third‑party ads. This move reflects the streaming giant’s effort to diversify revenue streams amid intensifying competition from Disney+, Hulu, and Amazon Prime Video. The test does not affect the core ad‑free subscription tier, which remains unchanged for the broader subscriber base.

FORWARD-LOOKING SIGNALS:
Analysts view the ad test as a precursor to a potential lower‑priced, ad‑supported subscription tier that could attract price‑sensitive consumers and boost overall subscriber growth. If successful, Netflix could generate significant incremental ad revenue, with some forecasts projecting an additional $1‑2 billion in annual earnings from an ad‑supported tier. The experiment also signals a broader industry shift toward hybrid models that blend subscription and advertising revenue, suggesting that other streaming services may soon explore similar strategies. Market participants will watch subscriber response and advertiser interest closely to gauge the viability of scaling the ad format in the coming quarters.",context
2018-08-21,338.0199890136719,"**KEY EVENTS AND FACTS:**  
- Investment bank William Blair issued a bullish price target for Netflix, projecting the stock to reach $660 per share by 2024, well above its current trading level.  
- The firm highlighted Netflix’s accelerating subscriber growth, expanding international footprint, and strong cash flow generation as primary drivers of the forecast.  
- Separately, market commentator Mike Khouw flagged unusually high options activity in Netflix, noting a surge in large‑block call contracts and elevated implied volatility.  
- The options flow suggests heightened investor interest and speculation ahead of upcoming earnings and potential strategic announcements.

**FORWARD-LOOKING SIGNALS:**  
- William Blair’s $660 target signals confidence that Netflix will sustain double‑digit revenue growth and improve profitability, implying a bullish outlook for the streaming sector through 2024.  
- The unusual options activity identified by Khouw may indicate market participants are positioning for a positive earnings surprise or a major corporate development, such as a price increase or new content slate.  
- Combined, the analyst’s long‑term forecast and the short‑term options positioning suggest a potential upward price trajectory in the coming months, especially if subscriber metrics continue to beat expectations.  
- Investors should monitor Netflix’s upcoming earnings release and any announcements regarding pricing, ad‑supported tiers, or international expansion, as these could validate the bullish projections and sustain the elevated options interest.",context
2018-08-22,344.44000244140625,"**KEY EVENTS AND FACTS:**  
- Verizon’s strong cash flow and dividend yield were highlighted as an under‑appreciated driver of Dow Jones performance, with analysts noting its recent earnings beat and modest share‑price rally.  
- Jim Cramer emphasized that the recent equity bull run has withstood ten distinct headwinds—including rising rates, trade tensions, and earnings volatility—suggesting market resilience.  
- A comparative analysis of Netflix, Amazon, and Nvidia underscored Nvidia’s superior earnings growth and AI‑related tailwinds, while Netflix and Amazon faced valuation pressures from slower subscriber growth and margin compression.  
- Wednesday’s analyst activity produced the ten largest price‑target adjustments, featuring upgrades for Nvidia and Verizon and downgrades for several high‑growth tech names, reflecting shifting risk appetites.  

**FORWARD-LOOKING SIGNALS:**  
- Analysts project that Verizon’s stable dividend and 5G rollout could sustain its outperformance, positioning it as a defensive play amid potential rate hikes.  
- Cramer’s confidence in the bull market suggests that, barring a major macro shock, equity momentum may continue, especially in sectors showing earnings resilience.  
- Nvidia’s AI leadership is expected to drive earnings acceleration, prompting bullish forecasts and higher price targets, whereas Netflix and Amazon may see slower growth trajectories.  
- The recent wave of price‑target revisions signals a market tilt toward high‑margin, technology‑driven stocks with clear growth catalysts, while more cyclical or overvalued names may face continued scrutiny.",context
2018-08-23,339.1700134277344,"KEY EVENTS AND FACTS:
- The Jackson Hole symposium opened with the Federal Reserve taking center stage, and Chairman Jerome Powell is slated to deliver a speech on Friday, drawing heightened market attention to monetary‑policy cues.  
- Imperial Capital released a series of updates on Netflix, noting that Apple’s App Store fee drops from 30% in the first subscription year to 15% thereafter, and that Netflix is testing the removal of Apple‑store sign‑ups in 33 countries to cut gate‑keeper costs.  
- The analyst reaffirmed an Outperform rating on Netflix, lifted the FY‑18 EPS estimate and set a $494 price target, citing modest gains in international subscriber numbers.  
- Benzinga promoted its new Pro Chat beta, encouraging traders to discuss hot stocks and breaking news in real time.

FORWARD-LOOKING SIGNALS:
- Powell’s upcoming remarks at Jackson Hole are expected to shape expectations for future rate moves, with markets likely to price in any shift toward a more dovish or hawkish stance.  
- Netflix’s strategy to eliminate or reduce Apple‑store fees could enhance margins and accelerate direct‑to‑consumer sign‑ups, supporting the analyst’s upward EPS revision and higher price target.  
- The experimental rollout in 33 markets suggests a broader push to bypass the App Store, potentially unlocking additional international growth and improving subscriber economics.  
- Continued interest in platforms like Benzinga Pro Chat indicates growing demand for rapid, crowd‑sourced market insights, which may amplify short‑term trading activity around macro and corporate news.",context
2018-08-24,358.82000732421875,"**KEY EVENTS AND FACTS:**  
- SunTrust Robinson Humphrey upgraded Netflix to “Buy” and cut its price target to $410, citing the recent pullback as an entry point.  
- Positive commentary from analyst(s) at M Science circulated among traders, helping lift Netflix shares about 3% on the day.  
- The market saw a broader set of price‑target revisions, with a “10 Biggest Price Target Changes” list highlighting Netflix among the most notable moves.  
- Benzinga’s August 24, 2018 roundup of upgrades and downgrades also featured Netflix’s upgrade, reinforcing the consensus bullish sentiment.

**FORWARD‑LOOKING SIGNALS:**  
- The convergence of multiple analyst upgrades and a new, higher price target suggests expectations of continued upside momentum for Netflix in the near term.  
- M Science’s favorable outlook, now being shared across trading desks, may act as a catalyst for further buying pressure and could sustain the stock’s rally.  
- The lowered price target to $410 by SunTrust implies confidence that Netflix can exceed current valuation levels despite the recent pullback.  
- The broader pattern of analyst optimism across the sector may indicate a bullish environment for streaming and digital entertainment stocks in the coming weeks.",context
2018-08-27,364.5799865722656,"**KEY EVENTS AND FACTS:**  
- Netflix announced the appointment of Rachel Whetstone, formerly a senior communications executive at Facebook, as its new Chief Communications Officer.  
- Whetstone’s departure from Facebook was confirmed, marking a high‑profile talent shift between two of the world’s largest digital media companies.  
- The move underscores Netflix’s ongoing effort to bolster its public‑relations and messaging capabilities as it expands globally and faces intensified competition in the streaming market.  
- No immediate market reaction was observed, but the leadership change is being noted by investors monitoring corporate governance and brand strategy.  

**FORWARD-LOOKING SIGNALS:**  
- Netflix’s hiring of a seasoned tech‑industry communicator suggests an upcoming emphasis on narrative control around its original content slate, pricing strategy, and international expansion, which could enhance subscriber growth forecasts.  
- The transition may signal Facebook’s internal restructuring of its communications team, potentially affecting how the platform addresses regulatory scrutiny and public perception in the coming quarters.  
- Analysts may view the appointment as a positive signal for Netflix’s brand positioning, possibly leading to stronger advertising partnerships and higher ad‑supported revenue as the company rolls out its ad‑tier.  
- The talent migration highlights a broader trend of cross‑industry leadership moves, indicating that streaming services are increasingly prioritizing sophisticated communications to differentiate themselves in a crowded market.",context
2018-08-28,368.489990234375,,context
2018-08-29,368.0400085449219,,context
2018-08-30,370.9800109863281,,context
2018-08-31,367.6799926757813,,context
2018-09-04,363.6000061035156,,context
2018-09-05,341.17999267578125,"**KEY EVENTS AND FACTS:**  
Tech‑sector equities retreated sharply on September 5 after high‑profile Senate hearings featuring executives from Twitter and Facebook, with the broader market reacting to heightened regulatory scrutiny.  Social‑media and internet stocks led the declines: Facebook fell 1.7%, Alphabet dropped 2.4%, Netflix slid 4.3%, Snap lost 4.6%, and Twitter tumbled 5.1%.  An accompanying infographic highlighted Google’s historical milestones, underscoring the long‑term growth narrative for the sector.  Meanwhile, a market commentary introduced a “timely” September‑focused ETF, suggesting investors were seeking sector‑specific exposure amid the volatility.  Morgan Stanley upgraded its price target for Apple, citing optimism around the company’s expanding video‑content ecosystem.

**FORWARD‑LOOKING SIGNALS:**  
Morgan Stanley’s raised Apple target signals confidence that the company’s video initiatives will drive earnings growth, potentially lifting the broader tech rally once regulatory concerns ease.  The steep sell‑off in Twitter, Facebook, and peers may create short‑term buying opportunities for value‑oriented investors, especially if the hearings result in limited immediate policy changes.  The promotion of a September‑focused ETF indicates that market participants expect continued sector rotation, likely favoring defensive or niche‑theme funds as uncertainty lingers.  Ongoing congressional scrutiny could lead to tighter data‑privacy or antitrust rules, which analysts are already pricing into future valuations for major platforms.  Overall, the mix of regulatory pressure and bullish analyst outlooks suggests a near‑term divergence between short‑term volatility and longer‑term growth expectations in the tech space.",context
2018-09-06,346.4599914550781,"KEY EVENTS AND FACTS:
Netflix’s shares rose between 2% and 2.1% in pre‑market and early trading on September 6, buoyed by RBC’s upgraded “Outperform” rating and a price‑target lift from $360 to $440. Analysts remain split, with some charts warning the stock is primed for a tumble while others cite a recent upgrade and market‑cycle optimism. A modest rebound was observed across major tech and social‑media names—including Snap, Twitter, Facebook, and Alphabet—following a day of declines tied to congressional hearings. Meanwhile, Canada‑U.S. trade negotiations are under a time crunch, and sector rotation is being noted as investors shift focus across industries.  

FORWARD-LOOKING SIGNALS:
RBC’s higher price target and “Outperform” stance suggest bullish expectations for Netflix’s earnings trajectory, though other analysts caution that broader market cycles could pressure the stock lower. The ongoing debate between bull and bear perspectives on Netflix highlights volatility that may persist as subscriber growth and pricing strategies unfold. The looming deadline on Canada‑U.S. trade talks could trigger sector‑specific moves, especially in commodities and manufacturing, if negotiations stall or accelerate. Finally, the modest tech rebound after the hearings may signal resilience, but continued regulatory scrutiny could temper momentum in the coming weeks.",context
2018-09-07,348.67999267578125,"KEY EVENTS AND FACTS:
Mark Cuban disclosed short positions in two biotech companies, signaling heightened bearish sentiment toward the sector. The U.S. labor market delivered a solid employment report, showing robust job growth and reinforcing confidence in the economy’s strength. Despite the positive jobs data, the technology sector entered its fourth consecutive day of sell‑offs, pulling down major tech indices and weighing on broader market performance. Overall, equity markets posted mixed results, with biotech stocks falling sharply on Cuban’s move while the broader index hovered near flat amid the employment‑driven optimism and tech weakness.  

FORWARD-LOOKING SIGNALS:
Cuban’s short bets suggest investors may anticipate upcoming challenges for biotech firms, such as tighter regulatory scrutiny or disappointing pipeline news, prompting a more defensive stance. The persistent tech sell‑off hints that momentum could continue into the upcoming earnings season, with analysts forecasting further price pressure if revenue guidance remains cautious. Strong employment figures bolster expectations that the Federal Reserve may maintain a gradual rate‑hike trajectory, supporting risk assets in the near term. However, the juxtaposition of solid macro data with sector‑specific weakness underscores a potential divergence in market drivers, signaling that future equity performance may hinge on sector‑specific catalysts rather than broad economic trends.",context
2018-09-10,348.4100036621094,,context
2018-09-11,355.92999267578125,,context
2018-09-12,369.9500122070313,"**KEY EVENTS AND FACTS:**  
- Investors are awaiting the imminent launch of the new Communication Services sector under the GICS framework, which will re‑classify many media, internet and telecom companies from the former Consumer Discretionary and Information Technology groups.  
- The broader market remained largely flat on the day, with the S&P 500 hovering near recent highs as traders adopted a cautious stance.  
- Attention is focused on Apple’s upcoming earnings report, slated for later in the week, and on scheduled central‑bank events, including the Federal Reserve’s policy meeting and the European Central Bank’s rate decision, both of which could move markets.  

**FORWARD‑LOOKING SIGNALS:**  
- Analysts expect the sector realignment to trigger significant portfolio rebalancing, potentially boosting the valuation of traditional telecoms while pressuring legacy media stocks.  
- Consensus forecasts for Apple point to strong revenue growth driven by services and wearables, but any miss could spark broader tech volatility.  
- Market participants are pricing in a modest probability of a Fed rate hike, with expectations that a dovish stance from the ECB could support risk assets, suggesting that upcoming policy outcomes will be key drivers of market direction in the near term.",context
2018-09-13,368.1499938964844,"**KEY EVENTS AND FACTS:**  
Asian equity markets opened higher on September 13, 2018, buoyed by upbeat commentary on China’s economic outlook and signs that inflation pressures are moderating. Traders highlighted recent statements from Chinese officials indicating a willingness to support growth, which lifted the Shanghai Composite and Hong Kong Hang Seng indices. U.S. futures also edged up as investors reassessed the risk of a near‑term rate hike amid the easing price‑fear narrative. Commodity prices, particularly oil and copper, slipped modestly as concerns over demand‑side inflation receded. Overall, the day’s trading was characterized by a cautious but positive tone across major global markets.

**FORWARD-LOOKING SIGNALS:**  
Analysts expect China’s “positive talk” to translate into targeted fiscal or monetary stimulus, potentially including infrastructure spending or credit easing, which could sustain the rally in Asian equities. The softening of inflation worries may reduce pressure on the Federal Reserve to accelerate rate hikes, keeping monetary policy relatively accommodative in the short term. Market participants are watching upcoming Chinese manufacturing PMI data and U.S. CPI releases for confirmation of the easing price environment. If China’s growth support materializes, it could bolster risk‑on sentiment and drive further gains in emerging‑market assets. Conversely, any reversal in Chinese policy tone or a resurgence of inflation could quickly shift sentiment back to caution.",context
2018-09-14,364.55999755859375,"KEY EVENTS AND FACTS:
Netflix announced that it will release its third‑quarter 2018 earnings on Tuesday, October 16, after the market close. The timing places the report at the end of a busy earnings season, with investors likely to compare Netflix’s performance to other streaming and media companies. The announcement itself has been noted by market participants as a potential catalyst for short‑term stock movement, especially given recent strong subscriber growth trends reported in prior quarters.

FORWARD-LOOKING SIGNALS:
Analysts are projecting that Netflix’s Q3 results will show continued subscriber expansion, driven by international market penetration and original content releases. Expectations are for earnings per share to beat consensus estimates, which could reinforce bullish sentiment and support higher valuation multiples. However, some forecasters caution that rising content costs and competitive pressure from new entrants may temper guidance, suggesting investors should watch for any revisions to the company’s 2018 outlook.",context
2018-09-17,350.3500061035156,"KEY EVENTS AND FACTS:
IMAX announced it is in negotiations with major streaming platforms, including Netflix, to distribute its upcoming titles directly to digital audiences. SunTrust analysts highlighted continued upside potential for Netflix’s third‑quarter performance, citing subscriber growth and strong content pipeline. Market commentary noted that prevailing “trade winds” – broader macro‑economic and technical factors – are creating resistance that could limit equity rally momentum. In India, e‑commerce giant Flipkart is evaluating a strategic investment in Hotstar, the popular video‑streaming service, to expand its digital entertainment footprint.  

FORWARD-LOOKING SIGNALS:
The IMAX‑streaming partnership talks suggest a shift toward hybrid theatrical‑digital release models, potentially reshaping box‑office revenue streams and boosting streaming content libraries. SunTrust’s optimism on Netflix implies expectations of higher-than‑projected earnings, which could drive the stock higher if subscriber targets are met. The cited market “trade winds” indicate that investors may remain cautious, awaiting clearer economic data before committing to risk‑on positions. Flipkart’s potential stake in Hotstar signals intensified competition in the Indian streaming market, hinting at future consolidation and cross‑border content collaborations.",context
2018-09-18,367.6499938964844,"**KEY EVENTS AND FACTS:**  
- On September 18, 2018, market analyst Mike Khouw highlighted unusually high options activity in Netflix (NFLX), noting that call‑option volume was several times the daily average while put‑option interest remained flat.  
- The surge in out‑of‑the‑money call buying coincided with Netflix’s stock trading near its recent highs, edging up modestly on the day despite broader market volatility.  
- No corporate announcement or earnings release was scheduled for that date, indicating the options activity was driven by speculative positioning rather than a disclosed catalyst.  
- The heightened options flow attracted attention from traders and prompted a brief uptick in trading volume for Netflix shares, though price movement remained within a narrow range.

**FORWARD‑LOOKING SIGNALS:**  
- Khouw’s observation suggests market participants are positioning for a potential positive catalyst, such as the upcoming Q3 earnings report where analysts expect Netflix to report subscriber growth and higher average revenue per user.  
- The concentration of call buying may reflect expectations of a new pricing strategy or the rollout of an ad‑supported tier, both of which could boost subscriber numbers and revenue.  
- Analysts have broadly forecast modest earnings beats for Netflix, and the unusual options activity could signal that investors anticipate the company will exceed those expectations, potentially driving the stock higher in the short term.  
- If the anticipated earnings beat materializes, the market may see a cascade of further bullish positioning, reinforcing an upward trend for Netflix in the weeks following the earnings release.",context
