t,y_t,text,split
2017-11-01,198.0,"KEY EVENTS AND FACTS:
Jim Cramer asserted that the recent equity market rally is “genuine,” emphasizing that strong earnings growth, robust consumer spending, and a favorable monetary policy environment are underpinning the uptrend. He highlighted that the S&P 500 and Nasdaq have posted solid gains, driven by technology and cyclical stocks outperforming expectations. Cramer also noted that corporate balance sheets remain healthy, with many companies reporting better-than-expected quarterly results, reinforcing investor confidence.

FORWARD-LOOKING SIGNALS:
Cramer’s optimism suggests continued bullish momentum, especially if earnings momentum sustains and the Federal Reserve maintains its accommodative stance. He anticipates that sectors tied to consumer discretionary and technology will lead future gains, provided inflation stays in check. Market participants may look for further upside as analysts project earnings growth rates to accelerate into the next quarter, signaling a potentially prolonged rally.",context
2017-11-02,199.32000732421875,"KEY EVENTS AND FACTS:
Papa John’s CEO publicly attributed a recent slowdown in pizza sales to the NFL’s reduced game schedule, suggesting that fewer football‑related gatherings have cut into the chain’s traditional peak‑time orders. He also hinted that the rise of streaming platforms such as Netflix is diverting consumer attention and discretionary spending away from take‑out meals. The comments came amid a modest decline in Papa John’s quarterly same‑store sales and a corresponding dip in the company’s stock price, which fell roughly 2% in after‑hours trading. The CEO announced plans to boost digital ordering and promotional tie‑ins with other entertainment venues to offset the loss of NFL‑driven traffic.

FORWARD-LOOKING SIGNALS:
Analysts expect the broader casual‑dining sector to continue feeling pressure from shifting home‑entertainment habits, forecasting a 1‑2% annual contraction in sales for pizza chains unless they accelerate digital and delivery initiatives. Papa John’s is likely to explore new partnership models, potentially aligning with streaming services for co‑branded promotions to recapture consumer spend. Market watchers anticipate that the company’s upcoming earnings report will include guidance on expanding its loyalty program and investing in AI‑driven ordering platforms, which could stabilize margins. If successful, these strategies may signal a broader industry pivot toward integrating food delivery with entertainment consumption trends.",context
2017-11-03,200.009994506836,"KEY EVENTS AND FACTS:
Netflix announced it is terminating its relationship with actor Kevin Spacey following renewed allegations of misconduct, marking a swift corporate response to the controversy. The decision was disclosed in a brief statement to Variety, with no immediate impact on Netflix’s subscriber numbers reported. Meanwhile, analysts highlighted Sirius XM’s continued growth potential, noting that the satellite radio provider posted solid subscriber gains and stable cash flow despite intensifying competition from streaming services. The commentary suggested that Sirius XM’s diversified revenue streams, including advertising and connected car partnerships, remain resilient. Market reaction was muted, with Netflix shares edging slightly lower on the news while Sirius XM stock saw modest gains on the positive analyst outlook.

FORWARD-LOOKING SIGNALS:
Industry observers expect Netflix’s decisive action on the Spacey issue to reinforce its brand integrity, potentially supporting subscriber retention and advertiser confidence in the long term. Analysts projecting Sirius XM’s future performance cite an expanding addressable market in automotive connectivity and a strategic focus on exclusive content, forecasting double‑digit earnings growth over the next two years. The competitive pressure from streaming platforms is anticipated to spur Sirius XM to accelerate its digital offerings, which could drive higher average revenue per user. Consensus estimates suggest Sirius XM’s stock may outperform the broader media sector if it successfully leverages its hybrid satellite‑streaming model. Overall, the market signals point to continued confidence in both companies’ ability to navigate reputational and competitive challenges.",context
2017-11-06,200.1300048828125,"KEY EVENTS AND FACTS:
- 21st Century Fox entered advanced merger talks with Disney, focusing on the divestiture of its non‑news, non‑sports assets.  
- Needham analyst Laura Martin, cited by CNBC’s Melissa Lee, estimated the transaction could cost Disney roughly $20‑30 billion and described it as a potential “#NFLX killer.”  
- Following a Faber research note that highlighted the Disney‑Fox deal’s implications for the streaming landscape, Netflix shares slipped sharply on the news.  

FORWARD-LOOKING SIGNALS:
- If the deal closes, Disney could significantly expand its direct‑to‑consumer portfolio, intensifying competition with Netflix and potentially reshaping pricing power in the streaming market.  
- Analysts anticipate that the $20‑30 billion price tag may pressure Disney’s balance sheet, prompting tighter capital allocation and possible share buy‑back adjustments.  
- Regulatory scrutiny of the merger, especially concerning antitrust concerns in the media sector, could delay closing and create short‑term volatility for both Disney and Fox stocks.  
- The market reaction to the Faber report suggests investors are wary of a possible over‑valuation of streaming assets, which may lead to more cautious earnings forecasts for Netflix in the coming quarters.",context
2017-11-07,195.88999938964844,"KEY EVENTS AND FACTS:
Wall Street’s M&A chatter on November 7 centered on three high‑profile potential deals: Broadcom’s rumored pursuit of Qualcomm, Disney’s ongoing negotiations to acquire key assets from 21st Century Fox, and SoftBank’s exploratory talks to buy Charter Communications. The Broadcom‑Qualcomm speculation sent both semiconductor stocks higher, with Broadcom shares up roughly 2% and Qualcomm edging lower on valuation concerns. Disney’s bid for Fox’s film and TV properties continued to drive media‑sector volatility, pushing Disney stock modestly higher while Fox shares fell on uncertainty. SoftBank’s possible Charter acquisition sparked interest in the telecom space, lifting Charter’s stock on the prospect of a premium offer. Overall, the market reacted positively to the prospect of consolidation, with the S&P 500 edging up on the back of M&A optimism.

FORWARD-LOOKING SIGNALS:
Analysts view the Broadcom‑Qualcomm talks as a potential catalyst for a major reshaping of the chip industry, forecasting that a successful bid could trigger further consolidation and heightened competition in 5G and IoT markets. Disney’s pursuit of Fox assets is expected to accelerate its streaming strategy, with forecasts suggesting the combined content library could boost Disney+ subscriber growth and improve long‑term revenue diversification. SoftBank’s interest in Charter hints at a strategic push into U.S. broadband, and market participants anticipate that a deal could spur increased capital expenditures in fiber deployment and potentially reshape pricing dynamics. The convergence of these M&A rumors is being interpreted as a signal that large conglomerates are positioning for growth in high‑margin, technology‑driven sectors, suggesting upward pressure on related equities in the coming quarters.",context
2017-11-08,196.44000244140625,"**KEY EVENTS AND FACTS:**  
- Reuters reported that Apple has outbid Netflix for the rights to a new television series starring Jennifer Aniston and Reese Witherspoon, prompting heightened investor attention on Netflix’s share price.  
- Disney announced it will release its fiscal fourth‑quarter earnings on November 9, with analysts expecting the results to influence the broader media and entertainment sector.  
- The FANG ETF posted a strong opening, reflecting continued investor confidence in the leading technology and internet stocks that comprise the fund.  
- Market participants are closely monitoring how Apple’s aggressive content acquisition and Disney’s upcoming earnings may reshape competitive dynamics in streaming and media distribution.

**FORWARD-LOOKING SIGNALS:**  
- Apple’s willingness to outbid a major competitor signals a strategic push into premium original content, suggesting future capital allocation toward exclusive programming that could pressure streaming rivals.  
- Anticipated Disney earnings are likely to set the tone for the entertainment industry’s revenue trajectory, with analysts projecting modest growth but heightened scrutiny on subscriber churn and ad‑supported streaming performance.  
- The solid start of the FANG ETF indicates sustained momentum in high‑growth tech stocks, reinforcing expectations of continued sector outperformance relative to broader market indices.  
- Collectively, these developments point to an increasingly content‑driven competitive landscape and a bullish outlook for technology‑centric media assets in the coming quarters.",context
2017-11-09,193.8999938964844,"KEY EVENTS AND FACTS:
- Disney’s chief executive, Bob Iger, told investors on the company’s earnings call that Disney’s forthcoming streaming services will be priced “substantially below” Netflix’s current subscription rates.  
- The statement came as Disney disclosed its Q3 earnings, highlighting strong performance in its parks and studio segments while noting that the streaming business is still in the investment phase.  
- Iger emphasized that the lower price point is intended to accelerate subscriber acquisition for Disney+, Hulu, and ESPN+ as the company prepares to launch a bundled offering later in the year.  
- Analysts noted that Disney’s guidance for streaming revenue remains modest, reflecting the high content costs and the need to achieve scale before profitability.  

FORWARD-LOOKING SIGNALS:
- The aggressive pricing strategy signals Disney’s intent to capture market share from Netflix, potentially reshaping the competitive dynamics of the U.S. streaming landscape.  
- Lower subscription fees are expected to boost Disney+ subscriber growth forecasts, with analysts projecting the platform could reach 130‑150 million global subscribers by the end of 2022.  
- The anticipated bundle could increase average revenue per user (ARPU) across Disney’s three streaming brands, offsetting the lower base price and improving long‑term monetization.  
- Market participants will watch for early subscriber uptake and churn rates after launch, as these metrics will inform whether Disney can sustain its investment in original content while achieving profitability.",context
2017-11-10,192.0200042724609,"KEY EVENTS AND FACTS:
Netflix announced it will not move forward with a second Louis CK stand‑up special, citing the comedian’s “unprofessional and inappropriate behavior with female colleagues.” The cancellation follows heightened scrutiny of talent conduct and may affect Netflix’s upcoming content slate. Disney disclosed that its streaming service pricing will be set “significantly less than Netflix,” positioning Disney+ as a lower‑cost alternative in the crowded market. Both announcements come as streaming platforms vie for subscriber growth amid intensifying competition and price sensitivity.  

FORWARD-LOOKING SIGNALS:
Analysts expect Netflix’s brand reputation to face short‑term pressure, potentially slowing subscriber acquisition and prompting tighter content vetting processes. Disney’s aggressive pricing strategy could accelerate its subscriber base expansion, especially among cost‑conscious households, and may force rivals to reconsider price points. The Louis CK decision signals a broader industry shift toward zero‑tolerance policies for misconduct, likely influencing talent contracts and risk assessments. Market observers anticipate heightened price competition in streaming, which could compress margins but also drive volume growth for lower‑priced services like Disney+.",context
2017-11-13,195.0800018310547,"**KEY EVENTS AND FACTS:**  
- Netflix announced that its service will be integrated into Cox Communications’ Contour platform, expanding its reach to Cox’s broadband customers.  
- Speculation that MoviePass’s parent, Helios & Matheson, is preparing to launch its own streaming movie service lifted the company’s stock, sending shares up to $13.50.  
- Helios & Matheson’s CEO reinforced the streaming rumor on CNBC, further fueling investor optimism.  
- Amazon revealed plans to produce a new “Lord of the Rings” series, underscoring its continued investment in premium original content.

**FORWARD-LOOKING SIGNALS:**  
- The Netflix‑Cox integration signals a trend toward bundling streaming services with traditional ISP offerings, which could pressure other cable operators to secure similar deals.  
- Helios & Matheson’s potential entry into the streaming market may intensify competition for subscription dollars, especially if the service leverages the MoviePass brand and data assets.  
- Amazon’s high‑budget “Lord of the Rings” series suggests that major studios will keep allocating sizable budgets to exclusive streaming titles, likely driving up content costs industry‑wide.  
- Investor enthusiasm for streaming‑related announcements indicates that market participants expect continued growth and volatility in the sector, making streaming‑centric stocks a focal point for short‑term trading strategies.",context
2017-11-14,195.7100067138672,"KEY EVENTS AND FACTS:
Tiger Global’s latest 13F filing revealed that the hedge fund increased its holdings in Meta Platforms (Facebook), Netflix, and Fiat Chrysler, while reducing its stake in Chinese e‑commerce firm JD.com. The portfolio adjustments were made after the firms’ recent earnings releases, indicating a strategic shift toward U.S. technology and automotive companies. The raised positions in Meta and Netflix suggest confidence in continued growth of digital advertising and streaming services. The trimmed exposure to JD.com reflects a de‑risking move away from Chinese consumer stocks amid regulatory uncertainty.

FORWARD-LOOKING SIGNALS:
Tiger Global’s larger bets on Meta, Netflix, and Fiat Chrysler signal expectations of robust U.S. consumer spending and a rebound in the automotive sector. The reduction in JD.com holdings may foreshadow broader investor caution toward Chinese e‑commerce amid tightening regulations. Analysts could interpret Tiger’s moves as a bullish indicator for the tech and auto stocks, potentially supporting higher price targets in the coming quarters. This reallocation hints at a market trend favoring U.S. growth assets over Chinese exposure, which may influence future fund flows and sector performance.",context
2017-11-15,192.1199951171875,"**KEY EVENTS AND FACTS:**  
- Sprint announced that its new unlimited data plan will include complimentary access to Hulu, a move aimed at bolstering subscriber growth and intensifying competition in the wireless‑streaming space.  
- The latest Q3 13F filings revealed that several heavyweight investors—including Warren Buffett, David Einhorn, and Paulson & Co.—rebalanced their holdings, with notable increases in financial services and consumer discretionary stocks and a reduction in exposure to energy.  
- Disney’s fourth‑quarter earnings report showed modest revenue growth and steady streaming subscriber numbers, leading analysts to expect the stock to trade within a narrow range in the near term.  
- Pre‑market technical analysis highlighted eight critical price levels across the S&P 500, Nasdaq, and Dow, identifying key support at 2,400 for the S&P and resistance near 7,800 for the Nasdaq.  

**FORWARD‑LOOKING SIGNALS:**  
- Sprint’s Hulu partnership may accelerate the convergence of telecom and media, prompting investors to watch for subscriber churn metrics and potential pricing pressure on rival carriers.  
- The portfolio adjustments by Buffett, Einhorn, and Paulson suggest confidence in a continued rally for financials and consumer stocks, while their reduced energy stakes could signal expectations of lower oil demand or price volatility.  
- Analysts project that Disney’s earnings momentum will likely remain flat unless the company can unlock higher margins from its streaming platforms or deliver a surprise in its parks segment.  
- Technical levels identified in the pre‑market prep imply that a breach of the 2,400 S&P support could trigger broader market downside, whereas holding above the 7,800 Nasdaq resistance may support a short‑term bullish bias.",context
2017-11-16,195.509994506836,"KEY EVENTS AND FACTS:
John Malone of Liberty Media warned that Amazon’s expanding video‑streaming business could soon surpass Netflix in subscriber numbers and market influence. The comment highlighted intensifying competition in the over‑the‑top (OTT) sector and raised concerns for Netflix’s growth outlook. Meanwhile, Intercontinental Exchange announced the launch of NYSE FANG+ Index futures, a new contract that tracks a basket of high‑growth technology and consumer‑discretionary stocks. The futures product provides investors with a direct, leveraged way to gain exposure to the “FANG+” group and is expected to add depth to the derivatives market.

FORWARD‑LOOKING SIGNALS:
Malone’s prediction signals that Amazon’s content investments and bundling strategies may accelerate, potentially reshaping streaming market share and prompting Netflix to adjust pricing or content spend. Analysts may begin revising revenue forecasts for both companies, with a bias toward higher growth for Amazon and a more cautious outlook for Netflix. The introduction of NYSE FANG+ futures reflects strong investor appetite for speculative positions on high‑beta tech stocks, suggesting continued volatility and momentum‑driven trading in that sector. Market participants are likely to use the new contract as a benchmark for risk management and as a barometer for future tech‑sector performance.",context
2017-11-17,193.1999969482422,,context
2017-11-20,194.1000061035156,"KEY EVENTS AND FACTS:
In Q3 2017, pay‑TV providers reported a widening subscriber loss, with total net churn rising to its highest level in years as cord‑cutting accelerates. Major operators such as Comcast, DirecTV and Sky each posted double‑digit subscriber declines, pushing industry‑wide revenue growth into negative territory for the quarter. The drop was driven largely by younger households abandoning traditional bundles in favor of over‑the‑top streaming services, while advertising spend on linear TV continued to soften. Analysts noted that the subscriber loss was broader than previously forecast, indicating a structural shift rather than a temporary dip.

FORWARD-LOOKING SIGNALS:
Industry analysts now project that the annual net subscriber loss could exceed 2 million households by the end of 2018, pressuring pay‑TV margins and prompting operators to accelerate bundling of streaming options. Forecasts suggest a continued migration of ad dollars toward digital platforms, with linear TV ad revenue expected to decline 3‑4 % year‑over‑year. Companies are likely to explore price hikes, tiered streaming add‑ons, or strategic partnerships with OTT players to stem churn. The trend also hints at potential consolidation in the sector as smaller operators seek scale to compete with dominant streaming services.",context
2017-11-21,196.22999572753903,"KEY EVENTS AND FACTS:
The Federal Communications Commission’s repeal of net‑neutrality rules sparked immediate commentary from industry analysts, including Wedbush’s Michael Pachter. Pachter noted that the regulatory change will likely force high‑bandwidth content providers such as Netflix to incur higher fees for network access. These additional costs could be passed on to end‑users, raising subscription prices for streaming services. The repeal also signals a shift in the cost burden toward the heaviest data consumers, potentially reshaping the pricing dynamics of broadband services.

FORWARD-LOOKING SIGNALS:
Analysts anticipate that streaming platforms will adjust pricing models or explore alternative delivery methods to offset the anticipated network fees. Heavy‑bandwidth users, including large enterprises and content distributors, may lobby for new pricing structures or seek private peering agreements to mitigate costs. The regulatory shift could accelerate investment in proprietary content delivery networks and edge computing solutions. Market participants are closely watching how the repeal influences consumer subscription rates and overall broadband demand, which may affect future earnings forecasts for both telecom operators and streaming companies.",context
2017-11-22,196.32000732421875,,context
2017-11-24,195.75,,context
2017-11-27,195.0500030517578,"KEY EVENTS AND FACTS:
- An analyst highlighted that Roku’s stock appears undervalued, suggesting the streaming hardware company may be poised for upside.  
- Netflix shares slipped 0.3% in early Monday trading despite the market’s awareness of a forthcoming subscription price increase that has been known since October.  
- Traders are noting recent commentary that the price hike could start to impact subscriber behavior around the Christmas season.  
- Jim Cramer reported that media mogul John Malone delivered a stronger bullish case for both Netflix and Amazon, reinforcing positive sentiment toward the two streaming giants.

FORWARD-LOOKING SIGNALS:
- The undervaluation thesis on Roku may attract value‑oriented investors, potentially driving the stock higher if earnings meet expectations.  
- Anticipated Netflix price increases could pressure subscriber growth in the short term, but the company may offset churn with higher average revenue per user, especially if the hike aligns with holiday spending.  
- Malone’s endorsement of Netflix and Amazon signals confidence in continued market share gains and could encourage institutional buying ahead of earnings releases.  
- Overall, the mix of analyst optimism for Roku and bullish commentary on Netflix and Amazon suggests a favorable outlook for the streaming sector, though price‑sensitivity around Netflix’s upcoming hike remains a key risk factor.",context
2017-11-28,199.17999267578125,"**KEY EVENTS AND FACTS:**  
- Citron Research publicly slammed streaming‑device maker Roku, calling it a “total joke,” which intensified scrutiny on the company’s valuation and helped push Roku’s share price lower on November 28, 2017.  
- In the same day’s commentary, a list of the “8 Most Undervalued Stocks Fund Managers Are Buying” was released, highlighting a cross‑section of companies—spanning technology, consumer discretionary, and industrial sectors—that fund managers view as attractive entry points.  
- The juxtaposition of Citron’s bearish stance on Roku with broader bullish interest in undervalued equities underscored a mixed market mood, with investors weighing short‑term risk against longer‑term value opportunities.  

**FORWARD-LOOKING SIGNALS:**  
- Citron’s aggressive criticism may foreshadow continued short‑term pressure on Roku, prompting investors to watch the company’s upcoming earnings guidance and subscriber growth for signs of a turnaround or further weakness.  
- The spotlight on eight undervalued stocks suggests a growing appetite among institutional investors for value‑oriented positions, potentially channeling capital into sectors that have lagged recent market rallies.  
- If earnings season validates the undervaluation thesis, the market could see a modest rotation from high‑growth, high‑valuation names toward these highlighted value plays, supporting a broader shift toward defensive, fundamentals‑driven investing.",context
