t,y_t,text,split
2018-12-10,269.70001220703125,"KEY EVENTS AND FACTS:
On December 10, 2018, analysts noted that the majority of FAANG stocks—Facebook, Apple, Amazon, Netflix, and Google—had slipped into bear‑market territory, each falling more than 20% from their recent peaks. Despite the sharp pullback, the article highlighted that these companies still command strong balance sheets, robust cash flows, and dominant market positions in their respective sectors. Valuation metrics, while compressed, remained attractive relative to historical averages, with price‑to‑earnings ratios still below long‑term norms for several of the names. The broader market was experiencing heightened volatility amid concerns over trade tensions and slowing global growth, which contributed to the sell‑off in high‑growth tech equities. Nonetheless, the piece emphasized that the underlying fundamentals of the FAANG group had not fundamentally deteriorated.

FORWARD-LOOKING SIGNALS:
Analysts cited the long‑term growth prospects of the FAANG cohort, projecting continued revenue expansion driven by cloud services, digital advertising, and subscription models, suggesting that the current dip could present a buying opportunity. Forecasts from major investment banks indicated that earnings per share for these firms are expected to rebound in 2019, supported by increasing consumer spending on digital platforms and ongoing innovation pipelines. The article also noted that monetary policy easing anticipated later in the year could provide a tailwind for tech valuations, potentially accelerating a recovery. Moreover, sentiment surveys showed a gradual shift toward optimism among institutional investors regarding the tech sector’s resilience, hinting at renewed inflows. Collectively, these forward‑looking indicators point to a potential re‑acceleration of FAANG stock performance over the medium term.",context
2018-12-11,265.32000732421875,"KEY EVENTS AND FACTS:
- A notable options sweep was observed for Netflix (NFLX) on December 11, 2018, involving 6 contracts of Jan‑25 $350 call options priced at $1.819, with an open interest of only 18 contracts, indicating a concentrated speculative interest near the ask price of 675.  
- Netflix is scheduled to report its quarterly earnings on January 22, 2019, after the market close, a key catalyst that may influence the observed options activity.  
- A correction was issued stating that Deutsche Bank did not initiate coverage on Netflix that morning; instead, Bloomberg had reported a sell rating initiation by DZ Bank, which remains unconfirmed.  
- The uncertainty around analyst coverage and the modest options open interest suggest limited institutional consensus on Netflix’s near‑term outlook as of the end of 2018.

FORWARD-LOOKING SIGNALS:
- The aggressive purchase of out‑of‑the‑money $350 calls ahead of earnings hints that some traders anticipate a significant upside move in Netflix’s stock price post‑announcement.  
- The low open interest and small sweep size imply that the bullish bet is not yet widely shared, potentially leaving room for a sharp reaction if earnings miss expectations.  
- The lack of confirmed sell‑rating initiation by DZ Bank may keep short‑selling pressure muted, allowing the bullish options flow to dominate short‑term sentiment.  
- Market participants will likely monitor the January 22 earnings release and any subsequent analyst upgrades or downgrades for clearer direction on Netflix’s valuation and volatility.",context
2018-12-12,274.8800048828125,,context
2018-12-13,276.0199890136719,,context
2018-12-14,266.8399963378906,,context
2018-12-17,262.79998779296875,"**KEY EVENTS AND FACTS:**  
Jefferies highlighted Manchester United’s “unparalleled reach,” underscoring the club’s global fan base and its attractiveness for sponsors and investors. MKM analysts projected that Netflix will deliver roughly 30% annual returns over the next five years, reflecting confidence in its growth trajectory. The New York Times reported on Netflix’s aggressive rollout of original movies, describing it as a “movie blitz” aimed at challenging traditional Hollywood studios. Together, these stories signal heightened attention on high‑profile entertainment assets across sports and streaming sectors.  

**FORWARD-LOOKING SIGNALS:**  
Jefferies’ endorsement may boost valuation expectations for top‑tier sports franchises and spur increased corporate sponsorship deals. MKM’s 30% return forecast suggests analysts anticipate continued subscriber growth, pricing power, and successful content monetization for Netflix. The “movie blitz” strategy indicates Netflix plans to invest heavily in original film production, potentially reshaping the competitive landscape with higher content spend and broader distribution. These forward‑looking cues point to sustained capital inflows into entertainment and media companies as investors seek exposure to their growth potential.",context
2018-12-18,270.94000244140625,,context
2018-12-19,266.7699890136719,"KEY EVENTS AND FACTS:
Facebook disclosed a new data‑privacy breach that exposed user information being shared with third‑party platforms such as Amazon, Netflix, and several other streaming and e‑commerce services. The company said the leak stemmed from a misconfigured API that allowed external partners to access certain user activity logs without explicit consent. Regulators in the EU and the U.S. have been notified, and the incident has prompted immediate internal audits and a public apology from Facebook’s leadership. Shares of Meta Platforms (FB) fell roughly 2.3% in after‑hours trading as investors weighed the potential legal and reputational costs. The story also reignited broader concerns about cross‑industry data sharing practices among major tech firms.

FORWARD-LOOKING SIGNALS:
Analysts predict heightened regulatory scrutiny could lead to stricter data‑privacy legislation, potentially increasing compliance costs for Facebook and its partners. Market watchers expect the episode to pressure Facebook’s advertising revenue growth, as advertisers may demand more transparent data handling assurances. The incident may accelerate Facebook’s push to develop proprietary data‑exchange frameworks, reducing reliance on external platforms. Investors are monitoring upcoming earnings calls for guidance on any anticipated fines or settlements, which could materially affect Meta’s FY2020 outlook.",context
2018-12-20,260.5799865722656,"**KEY EVENTS AND FACTS:**  
- Analysts maintained a positive outlook on Facebook despite recent privacy missteps, indicating continued confidence in the platform’s core business.  
- Netflix’s stock fell 4.3% after Buckingham Research reduced its price target from $406 to $382, reflecting heightened skepticism about the streaming giant’s near‑term growth.  
- The downgrade by Buckingham Research was the primary catalyst for the share price decline, underscoring the influence of analyst revisions on market sentiment.  

**FORWARD-LOOKING SIGNALS:**  
- The sustained analyst support for Facebook suggests that investors expect the company’s revenue streams and user engagement to remain robust despite regulatory scrutiny.  
- The lowered price target for Netflix signals that analysts anticipate slower subscriber growth or margin pressure, potentially prompting the company to adjust its content spending or pricing strategies.  
- Market participants may watch upcoming earnings reports and privacy‑related regulatory developments for both firms, as these could further shape forward‑looking valuations and sector momentum.",context
2018-12-21,246.38999938964844,,context
2018-12-24,233.8800048828125,"**KEY EVENTS AND FACTS:**  
Wall Street closed the week of December 24, 2018 with its steepest decline in a decade, as the S&P 500 fell roughly 9 % and the Dow Jones Industrial Average slipped about 8 % amid heightened trade‑war anxieties and concerns that the Federal Reserve’s aggressive rate‑hike cycle is overheating the economy. The sell‑off was amplified by weaker-than‑expected corporate earnings reports and a sharp drop in consumer confidence ahead of the holiday shopping season. Technology and industrial stocks led the losses, while safe‑haven assets such as gold and Treasury yields rose modestly as investors sought protection.  

**FORWARD‑LOOKING SIGNALS:**  
Analysts warn that volatility is likely to persist into early 2019, citing the possibility of further escalation in U.S.–China tariff negotiations and the Fed’s upcoming decision on whether to pause or continue rate hikes. The forthcoming release of holiday retail sales data will be a key gauge of consumer spending strength and could either bolster or further dampen market sentiment. Additionally, the earnings season that begins in January is expected to provide clearer insight into corporate profit margins, with many forecasters projecting a modest rebound if trade tensions ease. Investors are closely watching any signals from the Federal Open Market Committee and the White House for indications of policy shifts that could stabilize or destabilize markets in the near term.",context
2018-12-26,253.6699981689453,"KEY EVENTS AND FACTS:
Pivotal released its 2019 outlook for the media, internet, and communications sectors, highlighting a continued shift toward digital video streaming and over‑the‑top (OTT) services as traditional pay‑TV subscriptions decline. The firm noted that 5G network deployments are expected to accelerate, with major carriers planning to launch nationwide coverage by mid‑2020, which could boost data consumption and mobile video usage. Advertising spend is projected to move further into programmatic and addressable formats, with digital ad revenue anticipated to outpace print and broadcast by double‑digit percentages. Pivotal also pointed to increased consolidation activity, citing several pending mergers and acquisitions among content creators and platform operators. Finally, the report underscored rising consumer demand for personalized content experiences, driving investment in AI‑powered recommendation engines.

FORWARD-LOOKING SIGNALS:
Pivotal forecasts that global OTT subscriber bases will grow by roughly 15 % in 2019, suggesting robust revenue opportunities for streaming platforms and ancillary service providers. The firm expects 5G‑enabled applications, such as augmented reality advertising and ultra‑high‑definition mobile streaming, to generate an additional $12 billion in market value by the end of 2020. Programmatic ad spend is projected to capture 45 % of total digital advertising budgets, indicating a continued shift toward data‑driven buying models. Anticipated regulatory clarity on net‑neutrality in the U.S. could further stimulate investment in broadband infrastructure and content distribution. Collectively, these signals point to accelerated digital transformation and heightened competition across the media and communications landscape.",context
2018-12-27,255.57000732421875,"KEY EVENTS AND FACTS:
U.S. equity markets opened lower across the board on Thursday, with all major sectors posting declines after a day of strong gains on Wednesday. The broad sell‑off signaled a reversal of the previous session’s momentum, suggesting profit‑taking among investors. Trading volumes were moderate, and no specific corporate or economic news was cited as the catalyst for the pullback.

FORWARD-LOOKING SIGNALS:
The intra‑week correction may indicate heightened market sensitivity and a willingness to lock in gains, pointing to potential short‑term volatility. Analysts are likely to watch upcoming earnings releases and macro data for cues on whether the broader rally can resume. If the pullback is driven primarily by profit‑taking, it could set the stage for a renewed buying push once fresh catalysts emerge.",context
2018-12-28,256.0799865722656,"**KEY EVENTS AND FACTS:**  
- Netflix announced that its original film *Bird Box* has been viewed by 45,037,125 accounts in its first seven days, setting a new record for a Netflix‑released movie.  
- The company will no longer accept iTunes as a payment method for new subscribers, shifting all new sign‑ups to direct billing or other payment platforms.  
- A technology‑focused report highlighted twelve trends to watch over the next year, including AI‑driven personalization, 5G‑enabled streaming, and the rise of short‑form video content.  
- Netflix signed a lease for new office space in Mumbai, establishing a dedicated headquarters for its expanding operations in India.  

**FORWARD-LOOKING SIGNALS:**  
- The unprecedented *Bird Box* viewership underscores the continued market appetite for high‑impact original content, suggesting Netflix can leverage similar releases to drive subscriber growth and advertising revenue.  
- Dropping iTunes as a payment option may streamline onboarding, reduce transaction friction, and improve margin capture, but could also prompt short‑term churn among users accustomed to Apple’s ecosystem.  
- The identified tech trends—particularly AI personalization and 5G rollout—signal that streaming services will increasingly compete on data‑driven user experiences and ultra‑low latency delivery, shaping future investment priorities.  
- Establishing a Mumbai headquarters positions Netflix to tap the fast‑growing Indian market, where rising broadband penetration and a youthful demographic could add millions of new subscribers over the next 12‑18 months.",context
2018-12-31,267.6600036621094,"**KEY EVENTS AND FACTS:**  
- Loup Ventures analysts affirmed that Apple’s services ecosystem remains fundamentally strong, even as Netflix has withdrawn its streaming app from Apple’s platform.  
- The commentary highlighted continued growth in Apple’s subscription revenue streams—such as Apple TV+, Apple Music, and iCloud—offsetting any short‑term impact from the Netflix exit.  
- In the options market, traders placed a sizable sweep of 500 contracts of Jan 11 $290 Netflix call options at $3.10, pushing open interest to 303 contracts, signaling heightened activity ahead of the company’s earnings release.  
- Netflix is scheduled to report earnings on Jan 22 after the market close, with analysts estimating a reference price of $266.87 for the stock.  

**FORWARD-LOOKING SIGNALS:**  
- Loup Ventures’ confidence in Apple’s services model suggests that investors may continue to view Apple’s non‑hardware revenue as a stable growth driver, potentially supporting the stock’s upside in the coming quarters.  
- The aggressive buying of near‑term $290 calls on Netflix indicates market participants are betting on a stronger‑than‑expected earnings beat or positive guidance, which could trigger a short‑term rally if expectations are met.  
- Should Netflix’s earnings exceed consensus, the existing options pressure could amplify price momentum, while a miss may trigger rapid unwinding of the bullish call positions.  
- Overall, the combination of Apple’s resilient services outlook and bullish sentiment in Netflix options points to a broader market focus on tech subscription models and earnings‑driven volatility in early 2024.",context
2019-01-02,267.6600036621094,"**KEY EVENTS AND FACTS:**  
Apple slashed its Q1 revenue guidance, citing weaker iPhone sales, which sent its stock and broader tech shares lower on the morning of Jan. 2, 2019.  The market opened volatile amid disappointing China manufacturing data that underscored a soft start to the year.  Netflix announced Spencer Neumann as its new CFO, but the stock fell after SunTrust Research cut its price target, citing expectations that Q4 subscriber additions would miss guidance.  Benzinga’s afternoon list of the ten most‑searched tickers reflected heightened investor focus on Apple and Netflix amid the mixed news.

**FORWARD-LOOKING SIGNALS:**  
Apple’s guidance cut signals potential headwinds for the smartphone market and may prompt analysts to lower earnings forecasts for the remainder of the quarter.  The downgrade of Netflix’s price target suggests investors are wary of subscriber growth momentum, implying the company may need to accelerate content spending or pricing adjustments to meet expectations.  Weak Chinese manufacturing data points to slower global demand, which could weigh on consumer‑discretionary and tech sectors in the coming weeks.  Market participants will be watching upcoming earnings releases and any revisions to guidance from both Apple and Netflix for clues on the trajectory of tech‑driven growth in 2019.",context
2019-01-03,271.20001220703125,"KEY EVENTS AND FACTS:
- Benzinga Pro released its list of the top 10 most‑searched tickers for the afternoon of Thursday, Jan. 3, 2019, highlighting heightened investor interest in a mix of technology, financial and commodity‑related stocks.  
- Apple announced a reduction in its fiscal‑year guidance, citing escalating trade tensions and a slowdown in global economic growth, which pressured the broader tech sector and contributed to a modest dip in equity markets.  
- Netflix disclosed that, beginning with its Q4 2018 results, it will reclassify certain streaming‑personnel expenses on its consolidated statement of operations, a change that will affect the presentation of its cost structure but not the underlying cash flow.  

FORWARD‑LOOKING SIGNALS:
- Apple’s lowered outlook signals that trade‑related uncertainty and weaker demand may weigh on consumer‑technology earnings throughout the year, prompting analysts to trim price targets and anticipate more cautious spending by end‑users.  
- The reclassification by Netflix suggests the company is seeking greater transparency in its cost base, which could improve analysts’ ability to model future profitability and may foreshadow tighter margin expectations as the streaming market matures.  
- The composition of Benzinga’s most‑searched tickers—dominated by high‑growth tech and commodity names—indicates continued market focus on sectors likely to be sensitive to trade policy shifts, hinting at potential volatility in those stocks pending further macroeconomic data.",context
2019-01-04,297.57000732421875,"KEY EVENTS AND FACTS:
Analysts floated a potential new CFO for Netflix, sparking speculation about leadership changes at the streaming giant. A mid‑day snapshot showed 41 stocks moving actively, reflecting heightened market volatility. The broader market rebounded on optimism surrounding trade negotiations, a bounce in technology shares, and a stronger‑than‑expected jobs report. Goldman Sachs upgraded Netflix to a “Conviction Buy,” lifting its price target to $400, which sent the stock higher in trading.  

FORWARD‑LOOKING SIGNALS:
Goldman’s conviction‑buy designation signals confidence in Netflix’s growth trajectory and suggests the firm may outperform peers in the internet sector. The $400 price target implies a substantial upside from current levels, positioning Netflix as one of the best risk‑reward opportunities alongside Amazon, Alphabet, PayPal, and GrubHub. Continued trade optimism and a resilient labor market are expected to support further gains in tech‑heavy indices. Investors will watch the CFO appointment closely, as leadership stability could reinforce the bullish outlook projected by analysts.",context
2019-01-07,315.3399963378906,"**KEY EVENTS AND FACTS:**  
- Heavy options activity was recorded on Netflix, with a sweep of 500 $320 calls at $6.30 and 1,191 $400 calls at $1.10, indicating strong investor interest ahead of its earnings release on January 22.  
- Barclays reaffirmed its overweight rating on Netflix but trimmed its price target to $375, reflecting a more measured outlook despite the bullish options flow.  
- Guggenheim shifted its stance on Spotify to a neutral outlook, signaling a pause in the previously more aggressive expectations for the streaming platform.  
- A market‑wide roundup of the “58 Biggest Movers From Friday” highlighted heightened volatility across sectors, with technology and consumer discretionary stocks leading the gains and losses.  

**FORWARD‑LOOKING SIGNALS:**  
- The concentration of large‑volume call sweeps at higher strike prices suggests investors anticipate a significant upside for Netflix post‑earnings, potentially driving the stock above $350.  
- Barclays’ reduced price target, while maintaining an overweight rating, hints at a cautious optimism that may temper the rally but still supports a positive medium‑term trajectory.  
- Guggenheim’s neutral turn on Spotify points to expectations of modest growth or potential challenges in subscriber acquisition, which could dampen its near‑term upside.  
- The upcoming earnings announcements on January 22 for both Netflix and other tech names are likely to be key catalysts, with market participants closely watching guidance and subscriber metrics.  
- Overall market volatility, as reflected in the “58 Biggest Movers” list, suggests investors are positioning for divergent outcomes, making risk management and sector rotation important considerations in the short term.",context
2019-01-08,320.2699890136719,"**KEY EVENTS AND FACTS:**  
On the morning of Tuesday, Jan. 8 2019, Benzinga Pro released its daily “Top 10 Most‑Searched Tickers” list, highlighting the stocks that attracted the most investor attention that day. The rankings featured a blend of technology, financial and energy companies, indicating a diversified focus across sectors. The heightened search activity coincided with the start of the earnings season, prompting traders to seek information on upcoming corporate results and related news. Overall market sentiment appeared cautious but attentive, as investors scanned the list for potential trading opportunities.

**FORWARD‑LOOKING SIGNALS:**  
The prominence of certain tickers on the most‑searched list suggests that market participants expect significant price moves or news releases from those companies in the near term, often tied to earnings reports or macro‑economic developments. Elevated search volume can be an early indicator of upcoming volatility, prompting analysts to monitor these stocks for breakout or reversal patterns. Additionally, the cross‑sector composition of the list reflects a broader market anticipation of policy impacts—such as interest‑rate expectations and trade discussions—that could affect multiple industries. Investors may therefore weigh these signals when positioning portfolios for the remainder of the earnings season and beyond.",context
2019-01-09,319.9599914550781,"**KEY EVENTS AND FACTS:**  
- Hulu and Netflix reported stronger‑than‑expected subscriber additions for the latest quarter, with Hulu’s growth driven by its ad‑supported tier and Netflix adding several million new members worldwide.  
- The subscriber gains lifted the shares of both companies, prompting a rally in the broader streaming and digital entertainment sector, which outperformed the S&P 500 on the day.  
- In a separate market commentary, “Fast Money” analysts highlighted Foot Locker, Macy’s, Netflix, and U.S. Steel as their top picks for January 9, recommending long positions on the retailers and the steel producer while maintaining a bullish stance on Netflix.  
- The analyst round‑up noted that Foot Locker and Macy’s were poised to benefit from early‑season holiday sales, whereas U.S. Steel was expected to gain from higher commodity prices and a tightening supply outlook.

**FORWARD-LOOKING SIGNALS:**  
- Analysts project that Hulu’s ad‑supported model will continue to accelerate subscriber growth, potentially delivering double‑digit net additions each quarter and expanding the overall addressable market for streaming services.  
- Netflix’s robust subscriber pipeline, combined with upcoming price hikes and new content releases, is expected to sustain earnings momentum and support a higher valuation multiple through the fiscal year.  
- The “Fast Money” picks suggest that market participants anticipate a rebound in discretionary retail spending, with Foot Locker and Macy’s likely to see incremental sales as consumer confidence improves.  
- Rising steel prices and anticipated infrastructure spending under the upcoming fiscal budget are expected to bolster U.S. Steel’s earnings outlook, positioning the stock for continued upside.",context
