t,y_t,text,split
2018-03-23,300.94000244140625,"**KEY EVENTS AND FACTS:**  
- A dividend‑focused exchange‑traded fund was highlighted as an undervalued income vehicle, noting its above‑average yield, consistent dividend growth, and low expense ratio that have helped it outperform the broader market in recent weeks.  
- Meanwhile, market sentiment remained cautious as China signaled possible retaliatory trade measures against the United States, prompting heightened risk aversion on Wall Street.  
- The S&P 500 edged lower (or held flat) amid the trade‑tension backdrop, while the U.S. dollar gained modestly against a basket of currencies and Treasury yields slipped slightly as investors sought safety.  

**FORWARD‑LOOKING SIGNALS:**  
- Analysts project that continued low‑interest‑rate environments will drive more capital into high‑yield dividend ETFs, potentially supporting equity inflows and stabilizing valuations in the coming months.  
- The prospect of Chinese retaliation keeps trade negotiations uncertain, suggesting that volatility may remain elevated and that sectors sensitive to export demand could face pressure.  
- Market participants are watching for any policy response from the Federal Reserve; a slowdown in trade‑related growth could prompt the Fed to maintain an accommodative stance, reinforcing the appeal of dividend‑oriented strategies.",context
2018-03-26,320.3500061035156,"KEY EVENTS AND FACTS:
iShares announced the launch of seven new exchange‑traded funds that use artificial‑intelligence models to select and weight holdings, expanding the firm’s “robot‑powered” product lineup. The ETFs target themes such as robotics, autonomous technology, and AI‑driven innovation, and were introduced amid heightened investor appetite for technology‑focused passive vehicles. In parallel, research firm Vetr Crowd upgraded its rating on Netflix, moving the stock to a higher recommendation tier while still maintaining an overall bearish outlook. The upgrade cited recent improvements in subscriber metrics and content rollout, but the firm warned that competitive pressures and pricing headwinds keep the stock vulnerable.  

FORWARD-LOOKING SIGNALS:
The rollout of AI‑powered iShares ETFs signals a broader market shift toward systematic, data‑driven investment strategies, suggesting that capital may increasingly flow into technology and automation sectors over the coming months. Analysts expect the new funds to attract both retail and institutional inflows, potentially boosting valuations of underlying AI and robotics companies. Vetr Crowd’s cautious upgrade of Netflix hints at a short‑term price rebound, yet the lingering bearish stance underscores expectations of slower subscriber growth and margin compression ahead. Together, these developments point to a near‑term focus on AI exposure while maintaining vigilance on streaming‑sector earnings volatility.",context
2018-03-27,300.69000244140625,"**KEY EVENTS AND FACTS:**  
Vetr Crowd issued a downgrade on Netflix, citing concerns over slowing subscriber growth and heightened competition in the streaming market. The downgrade prompted an immediate dip in Netflix’s share price, which fell roughly 3% in after‑hours trading. The analyst note highlighted weaker-than‑expected international expansion metrics and rising content costs as primary risk factors. This move came amid a broader market focus on technology and media stocks, which saw mixed performance on the day. No other major corporate announcements or macroeconomic data were reported for March 27, 2018.

**FORWARD‑LOOKING SIGNALS:**  
Vetr Crowd’s downgrade signals expectations of tighter earnings margins for Netflix as it continues to invest heavily in original programming. Analysts now project a slower pace of subscriber additions, particularly outside the United States, which could temper revenue growth forecasts for the next two quarters. The downgrade also reflects a broader industry trend of increasing competition from new entrants such as Disney+ and Apple TV+, suggesting a more contested streaming landscape ahead. Investors may watch upcoming earnings releases for evidence of whether Netflix can sustain its growth trajectory despite these headwinds.",context
2018-03-28,285.7699890136719,"KEY EVENTS AND FACTS:
- Vetr Crowd upgraded Netflix to a “Hold” rating, while Citigroup kept a neutral stance but lifted its price target to $305, reflecting mixed analyst sentiment on the streaming giant.  
- The broader technology sector experienced a pullback on Tuesday, contributing to market “misery” amid concerns over earnings and valuation pressures.  
- A weekly roundup highlighted the five biggest price‑target revisions, with Netflix’s upward adjustment among the most notable changes.  
- Investors awaited a stronger-than‑expected GDP reading, which analysts suggested could counteract the recent tech weakness and restore market optimism.

FORWARD-LOOKING SIGNALS:
- The raised price target from Citigroup signals confidence that Netflix’s earnings trajectory may improve, potentially supporting a rebound in its stock price despite the Hold upgrade.  
- The mixed ratings indicate that while short‑term volatility is expected, longer‑term growth prospects for Netflix remain a focal point for investors.  
- Anticipated robust GDP data is seen as a catalyst for broader market optimism, likely benefiting risk‑on assets, including technology stocks, if the numbers exceed forecasts.  
- Market participants will watch upcoming earnings reports and macroeconomic releases to gauge whether the tech sector can recover and sustain any upside momentum.",context
2018-03-29,295.3500061035156,"**KEY EVENTS AND FACTS:**  
RBC Capital Markets issued a bullish rating on Spotify ahead of its planned IPO, setting a price target of $220 per share. The analysts highlighted the music‑streaming platform’s robust subscriber growth, expanding advertising revenue, and a clear path toward profitability. RBC expects the IPO to be priced in the $140‑$150 range, implying a potential upside of 45‑55% from the offering price. The coverage comes as the broader tech IPO market is showing renewed investor interest after a slowdown in 2017. Spotify’s listing is anticipated to be one of the largest European tech IPOs of the year.

**FORWARD-LOOKING SIGNALS:**  
RBC’s $220 target signals confidence that Spotify will sustain double‑digit revenue growth and improve margins through its podcast and advertising initiatives. The bank projects that post‑IPO liquidity will enable strategic acquisitions, further consolidating Spotify’s position in the streaming ecosystem. Analysts expect the IPO to set a positive precedent for other European tech listings, potentially spurring renewed capital‑raising activity in the sector. Market participants are watching for Spotify’s ability to monetize its growing user base, which could drive the stock toward the target price over the next 12‑18 months.",context
2018-04-02,280.2900085449219,"KEY EVENTS AND FACTS:
Netflix is reported to be in advanced negotiations to acquire Europacorp, the French film studio founded by Luc Besson, which has produced titles such as *The Fifth Element* and *Lucy*. The potential transaction would give Netflix direct access to a pipeline of European‑originated content and bolster its production capabilities in the region. Market reaction was modest, with Netflix shares edging higher on the news while European media stocks showed mixed responses. The move aligns with Netflix’s broader strategy of expanding its global content library to sustain subscriber growth amid intensifying competition.

FORWARD-LOOKING SIGNALS:
Analysts view the possible Europacorp acquisition as a signal that Netflix will continue to prioritize international original productions, likely accelerating the rollout of French‑language series and films. This could translate into higher subscriber acquisition rates in Europe and may prompt rival streaming services to pursue similar local studio partnerships or acquisitions. Forecasts for Netflix’s revenue growth in 2018‑2020 are being revised upward by some equity research firms, reflecting expectations of a stronger content slate and reduced reliance on licensed titles. The deal may also trigger regulatory scrutiny in the EU, setting a precedent for future cross‑border media consolidations.",context
2018-04-03,283.6700134277344,"**KEY EVENTS AND FACTS:**  
- Vetr Crowd, an investment research collective, upgraded Netflix (NFLX) to a “Buy” rating, citing strong subscriber growth and favorable content pipeline.  
- Concurrently, options market data showed a notable increase in May 18 $205 put contracts, with 700 contracts trading at $1.91 each versus a modest open‑interest of 89, indicating some short‑term bearish positioning despite the upgrade.  
- Netflix is scheduled to report its quarterly earnings after the market close on April 16, with analysts referencing a pre‑earnings price target of approximately $283.89.  
- The juxtaposition of a bullish analyst upgrade and heightened put activity reflects mixed short‑term sentiment ahead of the earnings release.  

**FORWARD-LOOKING SIGNALS:**  
- The “Buy” upgrade from Vetr Crowd suggests expectations of continued revenue acceleration and potential upside beyond current market pricing.  
- Heavy put buying at the $205 strike may signal that a segment of traders anticipates a corrective pullback or is hedging against downside risk ahead of earnings volatility.  
- Analysts are closely watching subscriber churn rates and international expansion metrics, which could drive the post‑earnings price trajectory.  
- If Netflix beats earnings expectations, the existing bullish sentiment could translate into a rapid price rally, whereas a miss may amplify the bearish pressure indicated by the put activity.",context
2018-04-04,288.94000244140625,,context
2018-04-05,293.9700012207031,,context
2018-04-06,288.8500061035156,"KEY EVENTS AND FACTS:
Netflix is reported to be among the bidders for Regency Outdoor Advertising, a Los Angeles‑based out‑of‑home (OOH) media company, with the bid rumored to exceed $300 million. The potential acquisition would mark Netflix’s first major foray into the traditional advertising space, signaling a strategic diversification beyond its core subscription model. Industry sources indicate that other undisclosed parties are also interested, underscoring heightened M&A activity in the media‑advertising sector. The news prompted modest movement in Netflix’s stock and sparked discussion among investors about the company’s growth trajectory.

FORWARD-LOOKING SIGNALS:
Analysts view the bid as a test of an ad‑supported revenue stream that could complement Netflix’s subscription business, especially if subscriber growth begins to plateau. Should the deal close, Netflix could leverage Regency’s OOH inventory to offer advertisers data‑driven, cross‑platform campaigns, potentially reshaping the OOH market’s pricing dynamics. The move may prompt rival streaming services to explore similar advertising acquisitions, intensifying competition for ad dollars. Market expectations now include a possible rollout of a lower‑priced, ad‑supported Netflix tier later in 2018 or early 2019, which could broaden the company’s addressable audience.",context
2018-04-09,289.92999267578125,,context
2018-04-10,298.07000732421875,"KEY EVENTS AND FACTS:
Investors rallied on April 10 as Facebook CEO Mark Zuckerberg testified before Congress, lifting FB shares 4.4% and pulling other FANG stocks to new highs—Amazon up 2.1%, Netflix up 2.8%, and Google up 1.68%. The testimony also touched on U.S.–China trade tensions, with Chinese officials’ comments easing some tariff concerns. Analyst round‑ups highlighted strong earnings expectations, and a separate piece listed the seven biggest price‑target revisions of the day. Both Raymond James and Morgan Stanley upgraded Netflix, maintaining overweight ratings and boosting price targets to $330 and $350 respectively.

FORWARD-LOOKING SIGNALS:
The raised Netflix price targets suggest analysts expect continued subscriber growth and revenue expansion, reinforcing the view that the streaming service is still in its “early stages.” Positive sentiment around the tech sector, buoyed by Zuckerberg’s testimony and the temporary trade‑war de‑escalation, may sustain momentum for other high‑growth stocks. Morgan Stanley’s and Raymond James’s bullish outlooks could prompt further institutional buying in Netflix and related media assets. Market participants will watch for any follow‑up policy moves on tariffs, as further easing could reinforce the current rally in technology equities.",context
2018-04-11,303.6700134277344,"KEY EVENTS AND FACTS:
Analysts highlighted a wave of activity across internet‑related equities, with a dedicated piece covering 18 internet stocks and their recommended actions. Moody’s upgraded Netflix’s senior unsecured debt rating from B1 to Ba3, citing a stable outlook, while both Goldman Sachs and JP Morgan raised their Netflix price targets to $360 and $328 respectively. Spotify and Hulu announced a joint bundled subscription priced at $12.99 per month, signaling a new competitive offering in the streaming space. The March IMX report showed investors maintaining a resilient stance despite market volatility, and Benzinga’s analyst call roundup reflected a broadly bullish tone on tech and media names.

FORWARD-LOOKING SIGNALS:
The consensus lift in Netflix’s price targets suggests expectations of continued subscriber growth and international expansion, with analysts pointing to the company’s scaling content library and distribution network. Moody’s rating upgrade may lower Netflix’s borrowing costs, potentially enabling further investment in original programming and market penetration. The Spotify‑Hulu bundle indicates a trend toward consolidated streaming packages, which could pressure standalone services and reshape pricing dynamics. Overall, the upward revisions and positive sentiment in the IMX imply that internet and streaming stocks are positioned for sustained momentum in the coming quarters.",context
2018-04-12,309.25,"**KEY EVENTS AND FACTS:**  
- On April 12, 2018, analysts from Benzinga highlighted several top picks, while major banks — JPMorgan, Wells Fargo, and Citigroup — were slated to begin the Q1 earnings season.  
- Netflix attracted significant attention ahead of its Q1 earnings report, with multiple analysts (KeyBanc, Wedbush’s Michael Pachter) publishing bearish notes.  
- Wedbush warned that reduced content inflows from Disney and a shift of Comcast, Time Warner, and Fox assets toward Hulu could depress subscriber satisfaction.  
- Pachter also projected that Netflix’s Q2 subscriber net additions would fall slightly short of last year’s figures, and the company would continue to burn cash to fund content acquisition for “many years.”  
- Despite the bearish sentiment, Netflix shares rose modestly (≈0.7%) in pre‑market trading.

**FORWARD-LOOKING SIGNALS:**  
- Analysts expect Netflix’s Q1 earnings to reflect pressure from a weaker content pipeline, potentially leading to lower revenue growth and higher cash burn.  
- The migration of premium studio content to competing streaming platforms (e.g., Hulu) is seen as a structural headwind that could erode Netflix’s subscriber growth and satisfaction metrics.  
- Wedbush’s guidance suggests Q2 net subscriber additions will be modest, signaling a slowdown in the company’s expansion trajectory.  
- The upcoming earnings releases from the big banks may set broader market tone, influencing investor risk appetite toward high‑growth tech stocks like Netflix.  
- Overall, the consensus points to a more cautious outlook for Netflix, with analysts anticipating tighter margins and continued heavy investment in original programming to offset content losses.",context
2018-04-13,311.6499938964844,"KEY EVENTS AND FACTS:
Netflix is slated to release its Q1 earnings report, prompting heightened market attention. Deutsche Bank upgraded Netflix to a “Buy” rating, sending the stock up about 2.5% in pre‑market trading and coinciding with news that Comcast will bundle Netflix subscriptions into its Xfinity packages. Hasbro’s shares jumped roughly $0.90 after rumors of Netflix interest, though the company declined to comment. Meanwhile, investors are gearing up for a wave of bank earnings, with Bank of America, Goldman Sachs, and Morgan Stanley slated to report later in the week. Overall market sentiment was positive, with U.S. stock futures edging higher and analysts noting strong lithium demand and other sector‑specific catalysts.

FORWARD-LOOKING SIGNALS:
The Deutsche Bank “Buy” upgrade and the expanded Comcast‑Netflix partnership signal confidence in continued subscriber growth and revenue upside for Netflix, suggesting a bullish near‑term trajectory. Hasbro’s share rally on speculative Netflix interest may indicate broader market appetite for cross‑industry collaborations, though the lack of official confirmation adds uncertainty. Upcoming earnings from major banks could set the tone for the financial sector, with analysts watching for guidance on loan growth and credit quality. Rising lithium demand highlighted in market commentary points to sustained momentum in the electric‑vehicle supply chain, potentially benefiting related equities. Collectively, these developments suggest a cautiously optimistic outlook for technology, consumer discretionary, and financial stocks in the coming weeks.",context
2018-04-16,307.7799987792969,"**KEY EVENTS AND FACTS:**  
Netflix reported Q1 2018 results that beat expectations, posting $3.701 billion in revenue (vs. $3.69 billion estimate) and GAAP EPS of $0.64, matching forecasts. The company added 7.41 million net streaming subscribers—1.96 million in the U.S. and 5.46 million internationally—surpassing analyst estimates of 6.43 million. Despite the growth, Netflix reiterated its free‑cash‑flow outlook of a $3‑$4 billion negative balance for FY18, warning that cash‑flow negativity will persist as original‑content spending accelerates. Shares jumped roughly 7% in after‑hours trading, contributing to a broader list of “stocks to watch” that day, which also featured banks, Qualcomm, Costco and other earnings releases amid geopolitical tension (missile attacks) and FDA actions.  

**FORWARD-LOOKING SIGNALS:**  
Analysts expect the strong international subscriber surge to drive future revenue growth, but the continued free‑cash‑flow deficit signals that Netflix will need to fund heavy content investments, potentially via debt or equity. The market’s positive reaction suggests confidence that subscriber growth will eventually translate into profitability, though investors will watch Q2 results closely for any shift in cash‑flow dynamics. The broader earnings season, highlighted by big‑bank reports and other tech releases, may set the tone for investor risk appetite, while geopolitical risks could introduce volatility that impacts discretionary spending on streaming services.",context
2018-04-17,336.0599975585937,"KEY EVENTS AND FACTS:
Netflix reported a blow‑out Q1 earnings beat, sending the stock sharply higher to a new 52‑week high of $333.99 and lifting the broader market as earnings momentum and easing geopolitical concerns boosted sentiment. Analysts across the street—Bank of America, Canaccord Genuity, BMO Capital, B. Riley, Credit Suisse, Morgan Stanley, KeyBanc, Stifel Nicolaus and others—maintained or upgraded their ratings on Netflix, collectively raising price targets ranging from $300 to $385. Meanwhile, Chinanet posted gains on its Q4 results while SeaChange shares fell, and Goldman Sachs topped Q1 expectations, contributing to a generally upbeat market backdrop. Several mid‑day and pre‑market updates highlighted a broad rally in stocks, with 27 stocks moving in the mid‑day session and 16 in the pre‑market, and futures surged ahead of the trading day.  

FORWARD-LOOKING SIGNALS:
The cluster of elevated price targets, especially the higher‑end $370‑$385 range from Morgan Stanley and KeyBanc, signals strong analyst confidence that Netflix’s subscriber growth and content strategy will sustain momentum into the second half of 2018. The reported shift of Netflix’s cloud infrastructure from AWS toward greater use of Google Cloud may hint at cost efficiencies and scalability that could further bolster margins. Market participants are watching the broader earnings season, with Goldman Sachs beating expectations and overall earnings lifts suggesting a continued bullish bias, provided geopolitical tensions remain subdued. The mixed analyst stances (neutral to underperform from Wedbush and Baird) indicate some caution, suggesting volatility could arise if subscriber growth slows or competition intensifies. These signals collectively point to a near‑term upside bias for Netflix and a generally positive outlook for growth‑oriented tech equities.",context
2018-04-18,334.5199890136719,"**KEY EVENTS AND FACTS:**  
- Netflix disclosed that it has explored purchasing theater chains, including Mark Cuban’s Landmark, as a tactic to improve its Oscar prospects.  
- The streaming giant also announced a roughly $1 billion commitment to original productions across Europe, underscoring its aggressive content‑creation push outside the U.S.  
- On the equity markets, Netflix joined a roster of companies—Citrix, Transocean, Motorola Solutions, Intel, NextEra Energy, PVH, Humana, Juniper Networks, and CSX—that posted new 52‑week highs on April 18, 2018.  
- Morgan Stanley reported earnings that comfortably beat analyst expectations, reinforcing the ongoing “big‑bank season.”  
- Benzinga Pro’s most‑searched tickers for the day and the list of the 32 biggest movers highlighted heightened investor interest in technology and media stocks, with Netflix featuring prominently.

**FORWARD‑LOOKING SIGNALS:**  
- Netflix’s potential theater acquisitions suggest a strategic shift toward hybrid distribution models, which could reshape the competitive dynamics between streaming services and traditional exhibitors.  
- The $1 billion European content spend signals confidence in regional subscriber growth and may drive higher future earnings for Netflix and its production partners.  
- The breadth of stocks hitting 52‑week highs indicates broad market optimism, particularly in tech and infrastructure sectors, hinting at continued upward momentum if earnings remain strong.  
- Morgan Stanley’s earnings beat may set a positive tone for other major banks, implying that the banking sector could sustain its outperformance through the remainder of the earnings season.  
- Elevated search activity for tickers like Netflix points to sustained investor focus on media‑streaming trends, which could translate into higher trading volumes and price volatility in the weeks ahead.",context
2018-04-19,332.70001220703125,"KEY EVENTS AND FACTS:
Amazon announced that its Prime subscription program has surpassed the 100 million member milestone, a figure that analysts say underscores the service’s deep penetration and recurring revenue stream. The news sparked a modest uptick in Amazon’s share price, with investors pricing in the potential for higher subscription‑based earnings and cross‑selling opportunities. Meanwhile, broader equity markets remained largely flat on the day, with major indices showing little movement and volatility indices at multi‑month lows as traders awaited fresh corporate guidance and macro data. Overall trading volume was subdued, reflecting a cautious stance among investors despite the headline‑grabbing Amazon announcement.

FORWARD-LOOKING SIGNALS:
The 100 million Prime milestone is being interpreted as a catalyst for continued revenue growth, prompting several equity analysts to raise their 12‑month price targets for Amazon, citing expanding services such as Prime Video, grocery, and cloud integration. Low market volatility and the directionless trading environment suggest that investors are in a “wait‑and‑see” mode, likely positioning for upcoming earnings releases from other tech giants and potential Federal Reserve commentary on interest rates. Market participants are also watching for Amazon’s next strategic moves—such as deeper forays into healthcare and international expansion—which could further amplify subscription momentum and influence sector rotation. These forward‑looking cues point to a near‑term focus on earnings beats and strategic announcements rather than immediate macro‑driven market shifts.",context
2018-04-20,327.7699890136719,,context
